"Story","Title","Result","Date","Stability","Duration (s)"
"Student CRUD test","Delete the Student and veify if student is deleted","SUCCESS","2018-08-12T15:30:49.270-06:00","0.0","2.39"
"Serenity id info","Get all student","SUCCESS","2018-08-12T15:29:42.648-06:00","0.0","3.46"
"First serenity test","Get all student","SUCCESS","2018-08-12T15:30:12.965-06:00","0.0","2.4"
"Student CRUD test","Student was added to the  applciation","SUCCESS","2018-08-12T15:30:36.599-06:00","0.0","8.98"
"Student CRUD test","This test Will Create New Student","SUCCESS","2018-08-12T15:30:30.293-06:00","0.0","6.29"
"Serenity id info","This test will get information student from Student App","SUCCESS","2018-08-12T15:29:14.870-06:00","0.0","27.77"
"Student CRUD test","Update the User Information and Verify updated information","SUCCESS","2018-08-12T15:30:45.586-06:00","0.0","3.68"
